{
  "schema_version": 1,
  "artifact_type": "experiment_analysis",
  "question_path": "questions/q001-throughput",
  "experiment_path": "questions/q001-throughput/experiments/exp001-completed",
  "title": "No measured claim",
  "execution_status": "completed",
  "hypothesis_verdict": "inconclusive",
  "objective": "Evaluate the experiment without reporting a measured claim.",
  "answer": "The backend did not return measured claims.",
  "meaning": "Semantic validation should require measured evidence.",
  "limitations": [
    "This fixture intentionally omits measured claims."
  ],
  "confidence": "low",
  "claims": []
}
